{"$defs":{"non_blank":{"minLength":1,"pattern":"^(?!\\s)(?!.*\\s$)[^\\u0000-\\u001F\\u007F-\\u009F]+$","type":"string"},"profile_id":{"pattern":"^[a-z][a-z0-9]*(?:-[a-z][a-z0-9]*)*$","type":"string"},"rule_id":{"pattern":"^(?:[A-Z0-9]+-){2,}[0-9]{3}$","type":"string"}},"$id":"urn:ifl:standards:schema:profile:v1","$schema":"https://json-schema.org/draft/2020-12/schema","additionalProperties":false,"properties":{"applicability":{"items":{"$ref":"#/$defs/non_blank"},"minItems":1,"type":"array","uniqueItems":true},"description":{"$ref":"#/$defs/non_blank"},"display_name":{"$ref":"#/$defs/non_blank"},"id":{"$ref":"#/$defs/profile_id"},"inherits_profile_ids":{"items":{"$ref":"#/$defs/profile_id"},"type":"array","uniqueItems":true},"owner_role_id":{"$ref":"#/$defs/non_blank"},"rule_ids":{"items":{"$ref":"#/$defs/rule_id"},"minItems":1,"type":"array","uniqueItems":true},"schema_version":{"const":1}},"required":["schema_version","id","display_name","description","owner_role_id","applicability","inherits_profile_ids","rule_ids"],"title":"IFL Canon Profile Record v1","type":"object"}
