{"applicability":["iOS features that adopt Boardy for board lifecycle, composition, navigation, or VIP presentation"],"description":"Boardy lifecycle, module, composition, communication, VIP, and humble-View obligations. Activate UIKit or SwiftUI alongside this profile when the feature renders UI.","display_name":"Boardy + VIP","id":"boardy-vip","inherits_profile_ids":["core"],"owner_role_id":"iOS Profile Owner","rule_ids":["BRD-ACTIVATION-001","BRD-BLOCKTASK-001","BRD-COMM-001","BRD-COMP-001","BRD-CTX-001","BRD-FLOW-001","BRD-ID-001","BRD-LIFE-001","BRD-MOD-001","BRD-NAV-001","BRD-REF-001","BRD-REPOSITORY-001","BRD-VIEWLESS-001","BRD-VIP-001","UI-COPY-001","UI-HUMBLE-001","UI-HUMBLE-002","UI-HUMBLE-003","UI-HUMBLE-004","UI-ISOLATION-001"],"schema_version":1}
