{"applicability":["iOS presentation features whose rendering adapter is a SwiftUI View"],"description":"SwiftUI rendering-adapter obligations layered on Core. Product state arrives display-ready through a MainActor presentation store; SwiftUI-local state remains transient UX state.","display_name":"SwiftUI Rendering Adapter","id":"swiftui","inherits_profile_ids":["core"],"owner_role_id":"SwiftUI Profile Owner","rule_ids":["UI-COPY-001","UI-HUMBLE-001","UI-HUMBLE-002","UI-HUMBLE-003","UI-HUMBLE-004","UI-ISOLATION-001"],"schema_version":1}
