{"applicability":["Every project and module governed by the IFL iOS Standards.","All UI frameworks, architecture profiles, and build systems."],"description":"Universal authority, evolution, and inward-dependency obligations that every specialized profile inherits and cannot weaken.","display_name":"IFL iOS Core","id":"core","inherits_profile_ids":[],"owner_role_id":"Canon Maintainer","rule_ids":["CAN-AUTH-001","CAN-AUTH-002","CAN-CONSIST-001","CAN-DERIVED-001","ADR-LIFECYCLE-001","CORE-DEP-001","CORE-DEP-002","CORE-DEP-003"],"schema_version":1}
