{"applicability":["iOS presentation features whose rendering adapter is UIViewController or another UIKit view type"],"description":"UIKit rendering-adapter obligations layered on Core, including display-ready input, MainActor isolation, dependency construction boundaries, and the shared humble-View contract.","display_name":"UIKit Rendering Adapter","id":"uikit","inherits_profile_ids":["core"],"owner_role_id":"iOS Profile Owner","rule_ids":["UI-COPY-001","UI-HUMBLE-001","UI-HUMBLE-002","UI-HUMBLE-003","UI-HUMBLE-004","UI-ISOLATION-001","UIKIT-DI-001","UIKIT-LIFE-001","UIKIT-RENDER-001"],"schema_version":1}
